study_id	pmid	doi	year	first_author	journal	cohort_type	dose_mg	dose_protocol	route	n_sa	n_ia	n_ra	sa_auc_mean_mg_h_per_L	sa_auc_sd_mg_h_per_L	ra_auc_mean_mg_h_per_L	ra_auc_sd_mg_h_per_L	sa_ra_auc_ratio_reported	sa_ra_ratio_ci_low	sa_ra_ratio_ci_high	sa_t_half_h	ra_t_half_h	sa_cmax_mg_per_L	ra_cmax_mg_per_L	nat2_calling_method	extraction_source	extraction_confidence	notes
kinzig-schippers2005	15855489	10.1128/AAC.49.5.1733-1738.2005	2005	Kinzig-Schippers M	Antimicrob Agents Chemother	healthy	100.0	single	PO	13	2	3	9.1	1.6	3.1	0.25	2.94	2.25	3.84	3.58	3.82	2.10	1.20	genotype_haplotype	abstract_table2	medium	Caucasian healthy volunteers, single 100 mg PO. SA group: *5A/*5B, *5A/*6A, *5B/*5B, *5B/*6A, *6A/*6A. RA group: *4/*4. AUC/dose values: SA 0.091 (range 0.067-0.132) h/L, RA 0.031 (range 0.027-0.037) h/L. SDs estimated from ranges via range/4 approximation. N(RA)=3 marginally violates protocol §1.5 #5 (N≥4 per group) — same caveat shape as SLCO1B1 Niemi 2006 men-stratum N(CC)=3. CI on SA/RA ratio approximated via delta-method from log-scale variance. Half-life surprisingly similar across groups (3.58 SA vs 3.82 RA) — suggests intra-group variability dominates the small-N rapid arm.
surarak2024	38566338	10.1111/cts.13795	2024	Surarak T	Clin Transl Sci	mixed-aggregate	300.0	mixed	PO			 	40.38	33.42	19.46	25.16	2.07				 	 	 	 	aggregate	abstract	low	Aggregated across 41 studies, NOT a primary single-study extraction. AUC0-24 values; SDs reflect inter-study heterogeneity not intra-study. Aggregate cannot enter DerSimonian-Laird pool because Ns per study not separately reported in accessible abstract. Retained as a sanity-check on the central tendency: aggregate SA/RA ≈ 2.07 (lower than Kinzig-Schippers 2.94 but within plausible range; difference likely reflects (a) the 13/3 Kinzig sample's skew toward more-extreme SA haplotypes, vs aggregated cohorts with mixed *5A/*6A/*7A etc.; (b) inclusion of TB patient cohorts in the aggregate, which differ from healthy volunteers).
seng2015	26282412	10.1128/AAC.01244-15	2015	Seng K-Y	Antimicrob Agents Chemother	healthy	300.0	single	PO							 	 	 	 	 	 	 	 	popPK_model	abstract	low	33 healthy Asians, popPK analysis. CL estimates: fast 65 L/h, intermediate 35 L/h, slow 8 L/h. SA/RA AUC ratio implied via inverse-CL = 65/8 = 8.13. NOT a per-group means + SDs extraction — this is the popPK MODEL's typical-value separation, which can over-estimate vs direct observation. Excluded from primary pool per protocol §1.7 sensitivity #4 (popPK ≠ direct-observation). Retained as supplementary signal that Asian-cohort SA/RA effect may be larger than Kinzig-Schippers Caucasians.
parkin1997	9154882	10.1164/ajrccm.155.5.9154882	1997	Parkin DP	Am J Respir Crit Care Med	tb_patients						 	 	 	 	 	 	 	 	 	 	 	 	genotype_haplotype	abstract	low	60 TB patients (47 with NAT2 genotyping). Demonstrated trimodality. Per-phenotype AUC means + SDs NOT in accessible abstract. Excluded from primary pool — supplementary citation that NAT2 trimodality is real. Full text would need separate access.
donald2007	17505821	10.1007/s00228-007-0305-5	2007	Donald PR	Eur J Clin Pharmacol	tb_patients	5.0	mixed	PO						 	 	 	 	 	 	 	 	genotype_haplotype	abstract	low	TB patients, 4 studies pooled, doses 3/5/6/10-12 mg/kg. Reports EBA(90) at AUC0-inf = 10.52 µg·h/mL but does NOT expose per-phenotype AUC means in abstract. N by phenotype reported (slow N varies by dose arm). Excluded from primary AUC pool — useful for clinical-relevance context but not for direct meta-analysis without full-text extraction.
kubota2007	17665185	10.1007/s00228-007-0333-1	2007	Kubota R	Eur J Clin Pharmacol	healthy	300.0	single	PO	0	8	8							 	 	 	 	genotype_haplotype	abstract	high	Dose-escalation study INCLUDED ONLY RA-type (N=8) and IA-type (N=8) — NO slow acetylators. Cannot extract SA/RA ratio. Excluded from primary pool per protocol §1.3 #4 (requires SA group reported). Retained for completeness of search log.
